plot_name,plot_source,x_label,x_data,y_data_label,y_data_1,y_data_2,y_data_3
Average Target Vehicle CO2e,,Calendar Year,calendar_year,Average Target Vehicle CO2e (g/mi),average_ICE_target_co2e_gpmi,average_BEV_target_co2e_gpmi,average_total_target_co2e_gpmi
Average Cert Vehicle CO2e,,Calendar Year,calendar_year,Average Cert Vehicle CO2e (g/mi),average_ICE_cert_co2e_gpmi,average_BEV_cert_co2e_gpmi,average_total_cert_co2e_gpmi
Average Vehicle Cost,,Calendar Year,calendar_year,Average Vehicle Cost ($),average_ICE_cost,average_BEV_cost,average_total_cost
Consolidated OEM Cost Total,,Calendar Year,calendar_year,Total Cost (Billion $),consolidated_OEM_total_cost_billions,,
Vehicle Share,,Calendar Year,calendar_year,Vehicle Share (%),abs_share_frac_ICE,abs_share_frac_BEV,
Consolidated OEM Sales Total,,Calendar Year,calendar_year,Consolidated OEM Sales Total,consolidated_OEM_sales_total,,
Consolidated OEM CERT and Target CO2e,,Calendar Year,calendar_year,CO2e (Mg),consolidated_OEM_target_co2e_Mg,consolidated_OEM_calendar_year_cert_co2e_Mg,
